id, gene, type, version, ALB, ARE, AUS, BFA, BGR, BIH, BRA, BWA, CAN, CHE, CHN, CIV, CMR, COD, CZE, DEU, ECU, ESP, EST, ETH, FIN, GEO, GHA, GRC, GTM, HKG, HRV, IND, IRN, ISL, ISR, JPN, KAZ, KEN, KHM, KOR, KWT, LCA, LKA, LTU, LVA, MAR, MDA, MKD, MLT, MNE, MOZ, MUS, MWI, MYS, NGA, NIC, NLD, NPL, NZL, PAK, PER, PHL, PRY, RKS, SAU, SEN, SRB, SVK, SWE, TCD, TGO, THA, TWN, TZA, UGA, USA, VNM, ZAF, ZMB
ant_2_Ia_1_X04555.R, ant_2_Ia_1_X04555, R, R, ALB, ARE, AUS, BFA, BGR, BIH, BRA, BWA, CAN, CHE, CHN, CIV, CMR, COD, CZE, DEU, ECU, ESP, EST, ETH, FIN, GEO, GHA, GRC, GTM, *, HRV, IND, IRN, *, ISR, JPN, KAZ, KEN, KHM, KOR, KWT, LCA, LKA, LTU, LVA, MAR, MDA, MKD, MLT, MNE, MOZ, MUS, MWI, MYS, NGA, NIC, NLD, NPL, *, PAK, PER, PHL, PRY, RKS, SAU, SEN, SRB, SVK, SWE, TCD, TGO, THA, TWN, TZA, UGA, USA, VNM, ZAF, ZMB
ant_2_Ia_6_AJ871915.R, ant_2_Ia_6_AJ871915, R, R, *, *, *, BFA, *, *, *, *, *, *, *, CIV, CMR, COD, *, *, *, *, *, *, *, *, GHA, *, *, *, *, *, *, *, ISR, *, *, KEN, *, *, *, *, *, *, *, *, *, *, *, *, *, *, MWI, *, NGA, *, *, *, *, *, *, *, *, *, *, *, *, *, *, TCD, TGO, *, *, TZA, UGA, *, *, *, ZMB
ant_2_Ia_20_AY139599.R, ant_2_Ia_20_AY139599, R, R, *, *, *, *, *, *, *, *, *, CHE, CHN, *, *, *, *, *, *, *, *, *, *, *, *, *, *, HKG, *, *, *, ISL, *, *, *, *, *, *, *, *, *, *, *, *, *, *, *, MNE, *, *, *, *, *, *, *, *, NZL, *, *, *, *, *, *, *, *, *, *, *, *, *, TWN, *, *, USA, *, ZAF, *
ant_2_Ia_13_DQ176450.R, ant_2_Ia_13_DQ176450, R, R, *, *, AUS, *, *, *, *, *, *, *, *, *, CMR, *, *, *, *, *, *, *, *, *, *, *, *, *, *, *, *, *, *, *, *, KEN, *, *, *, *, *, *, *, *, *, *, *, *, *, *, *, *, NGA, *, *, *, *, *, *, *, *, *, *, *, *, *, *, *, *, *, *, TZA, *, *, *, *, *
ant_2_Ia_9_HM367610.R, ant_2_Ia_9_HM367610, R, R, *, *, *, *, *, *, *, *, *, *, *, *, CMR, *, *, *, *, *, *, *, *, *, *, *, *, *, *, *, *, *, *, *, *, KEN, *, *, *, *, *, *, *, *, *, *, *, *, *, *, *, *, NGA, *, *, *, *, *, *, *, *, *, *, *, *, *, *, *, *, *, *, TZA, *, *, *, *, *
ant_2_Ia_6_AJ871915.v1, ant_2_Ia_6_AJ871915, v, 1, *, *, *, *, *, *, *, *, *, *, *, *, *, *, *, *, *, *, *, *, *, *, *, *, *, *, *, *, *, *, *, *, *, *, *, *, *, *, *, *, *, *, *, *, *, *, *, *, MWI, *, *, *, *, *, *, *, *, *, *, *, *, *, *, *, *, *, *, *, *, *, *, *, *, *, *
ant_2_Ia_19_GQ466184.v1, ant_2_Ia_19_GQ466184, v, 1, *, *, *, *, *, *, *, *, *, *, *, *, *, *, *, *, *, *, *, *, *, *, *, *, *, *, *, *, *, *, *, *, *, *, *, *, *, *, *, *, *, *, *, *, *, *, *, *, *, *, *, *, *, *, *, *, *, *, *, *, *, *, *, *, *, *, *, *, *, TZA, *, *, *, *, *
ant_2_Ia_13_DQ176450.v1, ant_2_Ia_13_DQ176450, v, 1, *, *, *, *, *, *, *, *, *, *, *, *, *, *, *, *, *, *, *, *, *, *, *, *, *, *, *, *, *, *, *, *, *, *, *, *, *, *, *, *, *, *, *, *, *, *, *, *, MWI, *, *, *, *, *, *, *, *, *, *, *, *, *, *, *, *, *, *, *, *, *, *, *, *, *, *
ant_2_Ia_19_GQ466184.R, ant_2_Ia_19_GQ466184, R, R, *, *, *, *, *, *, *, *, *, *, *, *, *, *, *, *, *, *, *, *, *, *, *, *, *, *, *, *, *, *, *, *, *, *, *, *, *, *, *, *, *, *, *, *, *, *, *, *, *, *, *, *, *, *, *, *, *, *, *, *, *, *, *, *, *, *, *, *, *, *, *, *, *, *, *
