id, gene, type, version, ALB, ARE, AUS, AUT, BEL, BEN, BFA, BGD, BGR, BIH, BRA, BRB, BWA, CAN, CHE, CHL, CHN, CIV, CMR, COD, COL, CZE, DEU, DNK, ECU, ESP, EST, ETH, FIN, FRA, GBR, GEO, GHA, GMB, GRC, GRL, GTM, HKG, HRV, HUN, IND, IRL, IRN, ISL, ISR, ITA, JPN, KAZ, KEN, KHM, KOR, KWT, LCA, LKA, LTU, LUX, LVA, MAR, MDG, MKD, MLT, MNE, MOZ, MUS, MWI, MYS, NGA, NIC, NLD, NOR, NPL, NZL, PAK, PER, PHL, POL, PRT, PRY, RKS, SAU, SEN, SGP, SRB, SVK, SVN, SWE, TCD, TGO, THA, TUR, TWN, TZA, UGA, URY, USA, VNM, ZAF, ZMB
sul1_9_AY963803.R, sul1_9_AY963803, R, R, *, ARE, AUS, AUT, BEL, BEN, BFA, BGD, BGR, BIH, BRA, BRB, BWA, CAN, CHE, CHL, CHN, CIV, CMR, COD, COL, CZE, DEU, DNK, ECU, ESP, EST, ETH, FIN, FRA, GBR, GEO, GHA, GMB, GRC, GRL, GTM, HKG, HRV, HUN, IND, IRL, IRN, ISL, ISR, ITA, JPN, KAZ, KEN, KHM, KOR, KWT, LCA, LKA, *, LUX, LVA, MAR, MDG, MKD, MLT, MNE, MOZ, MUS, MWI, MYS, NGA, NIC, NLD, NOR, NPL, NZL, PAK, PER, PHL, POL, PRT, PRY, RKS, SAU, SEN, SGP, SRB, SVK, SVN, SWE, TCD, TGO, THA, TUR, TWN, TZA, UGA, URY, USA, VNM, ZAF, ZMB
sul1_36_X15024.R, sul1_36_X15024, R, R, ALB, ARE, AUS, *, BEL, *, BFA, BGD, *, BIH, BRA, BRB, BWA, CAN, CHE, CHL, CHN, CIV, CMR, COD, *, CZE, *, DNK, ECU, ESP, *, ETH, FIN, *, GBR, *, GHA, *, GRC, GRL, GTM, HKG, *, *, IND, *, IRN, ISL, ISR, ITA, *, KAZ, KEN, KHM, *, KWT, LCA, *, LTU, LUX, LVA, MAR, *, MKD, MLT, MNE, MOZ, MUS, MWI, MYS, NGA, NIC, *, *, NPL, *, PAK, PER, PHL, *, *, PRY, RKS, SAU, SEN, *, *, SVK, *, SWE, *, TGO, THA, TUR, *, TZA, UGA, *, USA, VNM, *, ZMB
sul1_20_JF262165.R, sul1_20_JF262165, R, R, *, *, AUS, *, *, *, BFA, *, *, *, BRA, *, *, *, *, *, *, CIV, CMR, COD, *, *, DEU, *, *, *, *, *, *, *, GBR, *, GHA, *, *, *, *, *, HRV, *, *, *, *, *, ISR, *, *, *, KEN, *, *, *, *, *, *, *, *, *, *, *, *, *, *, MUS, MWI, *, NGA, *, *, *, *, *, *, *, *, *, PRT, *, *, *, *, *, *, *, *, SWE, *, TGO, *, *, TWN, TZA, UGA, *, USA, VNM, *, *
sul1_38_BX248359.R, sul1_38_BX248359, R, R, *, *, *, *, *, *, *, *, *, *, *, *, *, *, *, *, CHN, *, CMR, *, *, *, *, *, *, *, *, *, *, *, *, *, *, *, *, *, *, *, *, *, IND, *, *, *, *, *, *, *, *, KHM, *, KWT, *, *, *, *, *, *, *, *, *, *, *, *, MWI, *, NGA, *, *, *, NPL, *, *, *, PHL, *, *, *, *, *, SEN, *, *, *, *, *, *, *, *, *, *, TZA, UGA, *, *, VNM, *, *
sul1_5_EU780013.R, sul1_5_EU780013, R, R, *, *, *, *, *, *, BFA, *, *, *, BRA, *, *, *, *, CHL, *, CIV, *, COD, *, *, *, *, ECU, *, *, *, *, FRA, *, *, GHA, *, *, *, *, *, *, *, IND, *, *, *, ISR, *, *, *, *, *, *, *, *, *, *, *, *, *, *, *, *, *, *, *, MWI, *, *, *, *, *, *, *, PAK, PER, *, *, PRT, *, *, *, *, *, *, *, *, *, *, *, *, *, *, TZA, *, *, *, *, *, *
sul1_2_U12338.R, sul1_2_U12338, R, R, *, *, AUS, *, BEL, *, *, *, *, *, *, *, BWA, CAN, *, *, CHN, *, *, *, *, *, *, *, *, *, *, *, *, *, GBR, *, *, *, GRC, *, *, *, HRV, *, IND, *, IRN, *, *, *, *, *, *, *, *, *, *, *, *, *, LVA, *, *, *, *, *, *, *, *, *, *, *, *, NOR, *, *, *, *, *, *, *, *, *, *, *, *, *, *, *, *, TCD, *, *, *, *, *, *, *, *, *, *, *
sul1_8_JN581942.R, sul1_8_JN581942, R, R, *, *, *, *, *, *, *, *, *, *, *, *, *, *, *, *, CHN, *, *, *, *, *, *, *, *, *, *, *, *, *, *, *, *, *, *, *, *, *, *, *, *, *, *, *, *, *, *, *, *, *, *, *, *, *, *, *, *, *, *, *, *, *, *, *, *, *, *, *, *, *, *, *, *, *, *, *, *, *, *, *, *, *, *, *, *, *, *, *, *, *, *, *, *, URY, *, *, *, *
sul1_3_EU855787.R, sul1_3_EU855787, R, R, *, *, *, *, *, *, *, *, *, *, *, *, *, *, *, *, *, *, *, *, *, *, *, *, *, *, *, *, *, *, *, *, *, *, *, *, *, *, *, *, *, *, *, *, *, *, *, *, *, *, *, *, *, *, *, *, *, *, *, *, *, *, *, *, *, *, *, *, *, *, *, *, *, *, *, *, *, *, *, *, *, *, *, *, *, *, *, *, *, *, *, TZA, *, *, *, VNM, *, *
sul1_33_AJ564903.R, sul1_33_AJ564903, R, R, *, *, *, *, *, *, *, *, *, *, BRA, BRB, *, *, *, *, *, *, *, *, *, *, *, *, *, *, *, *, *, *, *, *, *, *, *, *, *, *, *, *, *, *, *, *, *, *, *, *, *, *, *, *, *, *, *, *, *, *, *, *, *, *, *, *, *, *, *, *, *, *, *, *, *, *, *, *, *, *, *, *, *, *, *, *, *, *, *, *, *, *, *, *, *, *, *, *, *, *
